### ISSUE TITLE
Passwd server on redundant VPC doesn't work after destroying last VM

### ISSUE THREAD

**Issue by remibergsma** [MissionCriticalCloud/cosmic-core#90]
Reported by @svanharmelen: I can reproduce that behaviour… create a VPC, Network, ACL, Server and all goed well. Destroy the server and create a new server, and it will not be able to do DNS (and I suppose any other network as well, but since I cannot login to a box I cannot confirm that).

On the router VM we don't see the request coming in using tcpdump (whereas it worked the first time). 

This is a dump from stop VM, reset passwd, start it again:

```
root@r-4571-VM:/var/cache/cloud# tcpdump -ni eth2 host 10.0.0.249
tcpdump: verbose output suppressed, use -v or -vv for full protocol decode
listening on eth2, link-type EN10MB (Ethernet), capture size 65535 bytes
10:31:31.201146 ARP, Request who-has 10.0.0.249 (ff:ff:ff:ff:ff:ff) tell 0.0.0.0, length 28
10:31:32.200509 ARP, Request who-has 10.0.0.249 (ff:ff:ff:ff:ff:ff) tell 0.0.0.0, length 28
10:31:33.229894 ARP, Request who-has 10.0.0.1 tell 10.0.0.249, length 28
10:31:33.229918 ARP, Reply 10.0.0.1 is-at 02:00:21:86:00:01, length 28
10:31:33.231359 IP 10.0.0.249.55826 > 10.0.0.1.53: 25243+ PTR? 249.0.0.10.in-addr.arpa. (41)
10:31:33.231533 IP 10.0.0.1.53 > 10.0.0.249.55826: 25243* 1/0/0 PTR remi3.cs2cloud.local. (75)
10:31:33.734292 IP 10.0.0.249.38513 > 10.0.0.1.53: 54744+ A? 0.centos.pool.ntp.org. (39)
10:31:33.734294 IP 10.0.0.249.38513 > 10.0.0.1.53: 803+ AAAA? 0.centos.pool.ntp.org. (39)
10:31:33.736528 IP 10.0.0.1.53 > 10.0.0.249.38513: 803 0/1/0 (109)
10:31:33.749532 IP 10.0.0.1.53 > 10.0.0.249.38513: 54744 4/0/0 A 146.185.139.19, A 146.185.130.223, A 213.154.229.24, A 77.72.146.250 (103)
10:31:33.850742 IP 10.0.0.249.123 > 146.185.139.19.123: NTPv4, Client, length 48
10:31:33.852475 IP 146.185.139.19.123 > 10.0.0.249.123: NTPv4, Server, length 48
10:31:33.933237 ARP, Request who-has 10.0.0.156 tell 10.0.0.249, length 28
10:31:34.050424 IP 10.0.0.249.123 > 146.185.130.223.123: NTPv4, Client, length 48
10:31:34.052147 IP 146.185.130.223.123 > 10.0.0.249.123: NTPv4, Server, length 48
10:31:34.250607 IP 10.0.0.249.123 > 213.154.229.24.123: NTPv4, Client, length 48
10:31:34.450427 IP 10.0.0.249.123 > 77.72.146.250.123: NTPv4, Client, length 48
10:31:35.850307 IP 10.0.0.249.123 > 146.185.139.19.123: NTPv4, Client, length 48
10:31:35.851754 IP 146.185.139.19.123 > 10.0.0.249.123: NTPv4, Server, length 48
10:31:36.050357 IP 10.0.0.249.123 > 146.185.130.223.123: NTPv4, Client, length 48
10:31:36.051972 IP 146.185.130.223.123 > 10.0.0.249.123: NTPv4, Server, length 48
10:31:36.250384 IP 10.0.0.249.123 > 213.154.229.24.123: NTPv4, Client, length 48
10:31:36.450411 IP 10.0.0.249.123 > 77.72.146.250.123: NTPv4, Client, length 48
10:31:39.060262 ARP, Request who-has 10.0.0.249 tell 10.0.0.58, length 28
10:31:39.061615 ARP, Reply 10.0.0.249 is-at 02:00:03:51:00:05, length 28
```

Needs to investigated what's going on.

**Comment by remibergsma** [comment]
This problem seems a symptom of #91
